Rank,Unix_Start_Time,Local_Start_Time,UTC_Start_Time,Characters,Seconds,CPS,WPM,Book,Chapter,Verse_Order,Verse,Verse #,Last 10 Avg,Last 100 Avg,Last 1000 Avg,cumulative_avg,Local_Start_Year,Local_Start_Month,Local_Start_Hour,Count,Local_Start_Date,Local_Start_Minute,Local_Start_10_Minute_Block,Local_Start_15_Minute_Block,Local_Start_30_Minute_Block,Local_End_Time,Local_End_Year,Local_End_Month,Local_End_Date,Local_End_Hour,Local_End_Minute,Local_End_15_Minute_Block,Local_End_10_Minute_Block,Local_End_30_Minute_Block,Mistake_Free_Test,WPM_Rank,WPM_Percentile,Backspaces as % of Verse Length,Incorrect Characters as % of Verse Length,Min Character Time (ms),Median Character Time (ms),Max Character Time (ms),Backspace % Last 10 Avg,Backspace % Last 100 Avg,Backspace % Last 1000 Avg,Session,Test_#_Within_Session,Incorrect Character % Last 10 Avg,Incorrect Character % Last 100 Avg,Incorrect Character % Last 1000 Avg,Test Version,Location,Keyboard,Layout,Caffeine,Custom_1,Custom_2,Custom_3,Autostart,Test #
1,1703873942.0,2023-12-29 13:19:01.545646,2023-12-29 18:19:01.545646+00:00,51,3.9683989,12.85153063,154.2183675,JHN,1,30329,"In him was life, and the life was the light of men.",4.0,172.11429321,139.50863383,134.68333822091998,133.642,2023,12,13,1,2023-12-29,19,2,2,1,2023-12-29 13:19:05.514044900,2023,12,2023-12-29,13,19,2,2,1,0.0,1387,83.30723834758521,1.960784314,1.960784314,,,,,,,144,4,1.6925237236000015,,,,,,,,,,,,6531
2,1703873932.0,2023-12-29 13:18:52.423724,2023-12-29 18:18:52.423724+00:00,39,3.0595708,12.74688594,152.9626312,JHN,1,30327,The same was in the beginning with God.,2.0,169.79517382,139.013274854,134.60199215822,133.633,2023,12,13,1,2023-12-29,18,2,2,1,2023-12-29 13:18:55.483294800,2023,12,2023-12-29,13,18,2,2,1,1.0,1525,81.64518848608937,0.0,0.0,,,,,,,144,2,3.0032946076000018,,,,,,,,,,,,6529
3,1703873936.0,2023-12-29 13:18:55.631708,2023-12-29 18:18:55.631708+00:00,83,5.7687342,14.38790506,172.6548607,JHN,1,30328,"All things were made through him. Without him, nothing was made that has been made.",3.0,169.25536494,139.434009346,134.65148274012,133.639,2023,12,13,1,2023-12-29,18,2,2,1,2023-12-29 13:19:01.400442200,2023,12,2023-12-29,13,19,2,2,1,1.0,213,97.44670600987595,0.0,0.0,,,,,,,144,3,2.8663083062000014,,,,,,,,,,,,6530
4,1703873946.0,2023-12-29 13:19:05.660544,2023-12-29 18:19:05.660544+00:00,70,5.3942312,12.97682606,155.7219127,JHN,1,30330,"The light shines in the darkness, and the darkness hasn't overcome it.",5.0,168.17277764,139.788324823,134.66826656102,133.645,2023,12,13,1,2023-12-29,19,2,2,1,2023-12-29 13:19:11.054775200,2023,12,2023-12-29,13,19,2,2,1,1.0,1221,85.30651571721066,0.0,0.0,,,,,,,144,5,1.6925237236000015,,,,,,,,,,,,6532
5,1703873926.0,2023-12-29 13:18:46.149865,2023-12-29 18:18:46.149865+00:00,79,6.1199081,12.90869057,154.9042869,JHN,1,30326,"In the beginning was the Word, and the Word was with God, and the Word was God.",1.0,167.97927542,138.95268137899998,134.59570570592,133.63,2023,12,13,1,2023-12-29,18,2,2,1,2023-12-29 13:18:52.269773100,2023,12,2023-12-29,13,18,2,2,1,0.0,1320,84.11417559918102,1.265822785,1.265822785,,,,,,,144,1,4.236171319600002,,,,,,,,,,,,6528
6,1703873957.0,2023-12-29 13:19:17.494991,2023-12-29 18:19:17.494991+00:00,102,7.4696348,13.65528607,163.8634328,JHN,1,30332,"The same came as a witness, that he might testify about the light, that all might believe through him.",7.0,166.95014596000001,140.31735602339998,134.71352674791999,133.647,2023,12,13,1,2023-12-29,19,2,2,1,2023-12-29 13:19:24.964625800,2023,12,2023-12-29,13,19,2,2,1,1.0,586,92.95435384800675,0.0,0.0,,,,,,,144,7,1.0918914791000014,,,,,,,,,,,,6534
7,1703873417.0,2023-12-29 13:10:17.088901,2023-12-29 18:10:17.088901+00:00,73,4.3037524,16.96194233,203.5433079,EXO,37,2610,"He put the poles into the rings on the sides of the ark, to bear the ark.",5.0,166.08015056000002,138.64480207,134.56656199962,133.626,2023,12,13,1,2023-12-29,10,2,1,1,2023-12-29 13:10:21.392653400,2023,12,2023-12-29,13,10,1,2,1,1.0,1,100.0,0.0,0.0,,,,,,,143,9,5.181017612100002,,,,,,,,,,,,6527
8,1703873952.0,2023-12-29 13:19:11.884680,2023-12-29 18:19:11.884680+00:00,52,5.447674,9.545358257,114.5442991,JHN,1,30331,"There came a man sent from God, whose name was John.",6.0,164.22271458,139.541231428,134.66901419752,133.642,2023,12,13,1,2023-12-29,19,2,2,1,2023-12-29 13:19:17.332354000,2023,12,2023-12-29,13,19,2,2,1,0.0,6777,18.390943032638805,7.692307692,7.692307692,,,,,,,144,6,1.9138092873000017,,,,,,,,,,,,6533
9,1703876961.0,2023-12-29 14:09:21.208841,2023-12-29 19:09:21.208841+00:00,210,15.931522,13.18141481,158.1769777,DEU,10,5191,"He wrote on the tablets, according to the first writing, the ten commandments, which the LORD spoke to you on the mountain out of the middle of the fire in the day of the assembly; and the LORD gave them to me.",4.0,162.94647275,140.89726270740002,134.75519992212,133.651,2023,12,14,1,2023-12-29,9,1,1,1,2023-12-29 14:09:37.140363000,2023,12,2023-12-29,14,9,1,1,1,0.0,994,88.04046730097555,2.380952381,3.80952381,,,,,,,145,1,1.4728438601000016,,,,,,,,,,,,6535
10,1703568089.0,2023-12-26 00:21:28.972006,2023-12-26 05:21:28.972006+00:00,238,18.4104973,12.92740745,155.1288894,DEU,1,4910,"You shall not show partiality in judgment; you shall hear the small and the great alike. You shall not be afraid of the face of man, for the judgment is God's. The case that is too hard for you, you shall bring to me, and I will hear it.""",17.0,162.45131104,140.4899377155,134.1056701903,133.498,2023,12,0,1,2023-12-26,21,3,2,1,2023-12-26 00:21:47.382503300,2023,12,2023-12-26,0,21,2,3,1,0.0,1282,84.57184150307117,1.260504202,1.260504202,,,,,,,136,200,1.1154677272,4.7351371036,6.401207170355,,,,,,,,,,6215
11,1701439839.0,2023-12-01 09:10:39.207421,2023-12-01 14:10:39.207421+00:00,144,10.46573663,13.75918439,165.1102126,LEV,13,3089,"then the priest shall examine him; and behold, if the itch has spread in the skin, the priest shall not look for the yellow hair; he is unclean.",36.0,162.08222310000002,141.9182986636,137.69573514609002,132.965,2023,12,9,1,2023-12-01,10,2,1,1,2023-12-01 09:10:49.673157630,2023,12,2023-12-01,9,10,1,2,1,0.0,507,93.90581717451524,3.472222222,3.472222222,3.000736237,57.00075626,151.8707275,1.971576443,4.477665133,,100,47,1.9295596365,4.37625399506,,,,,,,,,,,3242
12,1701439763.0,2023-12-01 09:09:23.032110,2023-12-01 14:09:23.032110+00:00,209,14.02531767,14.90162326,178.8194791,LEV,13,3084,"If the priest examines the plague of itching, and behold, its appearance isn't deeper than the skin, and there is no black hair in it, then the priest shall isolate the person infected with itching seven days.",31.0,161.73253960000002,141.050059274,137.48031966636998,132.925,2023,12,9,1,2023-12-01,9,1,1,1,2023-12-01 09:09:37.057427670,2023,12,2023-12-01,9,9,1,1,1,1.0,72,99.14488739009997,0.0,0.0,2.998352051,62.01016903,381.4196587,1.729218125,4.657396743,,100,42,1.6319526995,4.550303786080001,,,,,,,,,,,3237
13,1703568119.0,2023-12-26 00:21:59.399358,2023-12-26 05:21:59.399358+00:00,64,6.3702273,10.04673726,120.5608472,DEU,1,4911,I commanded you at that time all the things which you should do.,18.0,161.43705278,140.2005014565,134.0813522838,133.496,2023,12,0,1,2023-12-26,21,3,2,1,2023-12-26 00:22:05.769585300,2023,12,2023-12-26,0,22,2,3,1,0.0,6110,26.424184029868726,9.375,21.875,,,,,,,136,201,2.8366464837,4.9538871036,6.420051867325001,,,,,,,,,,6216
14,1704175531.0,2024-01-02 01:05:31.211934,2024-01-02 06:05:31.211934+00:00,77,6.0827587,12.65872999,151.9047599,DEU,10,5203,"Circumcise therefore the foreskin of your heart, and be no more stiff-necked.",16.0,161.05493139,143.33428106539998,135.10182983605,133.693,2024,1,1,1,2024-01-02,5,1,1,1,2024-01-02 01:05:37.294692700,2024,1,2024-01-02,1,5,1,1,1,1.0,1656,80.06744550162593,0.0,0.0,,,,,,,148,3,3.000921052100001,,,,,,,,,,,,6550
15,1703568073.0,2023-12-26 00:21:13.486429,2023-12-26 05:21:13.486429+00:00,174,12.727426,13.67126393,164.0551672,DEU,1,4909,"I commanded your judges at that time, saying, ""Hear cases between your brothers and judge righteously between a man and his brother, and the foreigner who is living with him.",16.0,160.82141581000002,140.2310387275,134.1034250876,133.494,2023,12,0,1,2023-12-26,21,3,2,1,2023-12-26 00:21:26.213855000,2023,12,2023-12-26,0,21,2,3,1,0.0,573,93.11092376249547,0.574712644,0.574712644,,,,,,,136,199,1.4149492219000002,4.77687988767,6.402783545586001,,,,,,,,,,6214
16,1701439741.0,2023-12-01 09:09:01.032887,2023-12-01 14:09:01.032887+00:00,238,17.01439953,13.9881516,167.8578192,LEV,13,3083,"then the priest shall examine the plague; and behold, if its appearance is deeper than the skin, and the hair in it is yellow and thin, then the priest shall pronounce him unclean. It is an itch. It is leprosy of the head or of the beard.",30.0,160.71843311,140.682491757,137.40273921307,132.911,2023,12,9,1,2023-12-01,9,1,1,1,2023-12-01 09:09:18.047286530,2023,12,2023-12-01,9,9,1,1,1,0.0,376,95.48356015897869,1.680672269,1.260504202,1.999855042,58.02941322,176.6030788,1.729218125,4.695613303,,100,41,1.6319526995,4.58852034659,,,,,,,,,,,3236
17,1701267848.0,2023-11-29 09:24:07.855439,2023-11-29 14:24:07.855439+00:00,187,12.53185558,14.92197215,179.0636658,LEV,8,2944,"and out of the basket of unleavened bread that was before the LORD, he took one unleavened cake, one cake of oiled bread, and one wafer, and placed them on the fat and on the right thigh.",26.0,160.52116272,142.2363108565,134.87012988946003,132.492,2023,11,9,1,2023-11-29,24,3,2,1,2023-11-29 09:24:20.387294580,2023,11,2023-11-29,9,24,2,3,1,1.0,68,99.19306274840419,0.0,0.0,15.99812508,57.00302124,311.7966652,2.426991761,4.903258306,,97,54,2.3811202009,4.81776370163,,,,,,,,,,,3097
18,1701439853.0,2023-12-01 09:10:53.455546,2023-12-01 14:10:53.455546+00:00,147,14.19538188,10.35548048,124.2657658,LEV,13,3090,"But if in his eyes the itch is arrested and black hair has grown in it, then the itch is healed. He is clean. The priest shall pronounce him clean.",37.0,160.16453569,141.90905427459998,137.68557213948998,132.963,2023,12,9,1,2023-12-01,10,2,1,1,2023-12-01 09:11:07.650927880,2023,12,2023-12-01,9,11,1,2,1,0.0,5630,32.20522702637601,10.88435374,10.88435374,4.997014999,61.40494347,162.7793312,2.665274975,4.522872307,,100,48,2.6232581684,4.42146116882,,,,,,,,,,,3243
19,1701439800.0,2023-12-01 09:09:59.872745,2023-12-01 14:09:59.872745+00:00,129,9.002957821,14.32862428,171.9434913,LEV,13,3086,"then he shall be shaved, but he shall not shave the itch. Then the priest shall isolate the one who has the itch seven more days.",33.0,160.10756450000002,141.7764882276,137.53855320827,132.943,2023,12,9,1,2023-12-01,9,1,1,1,2023-12-01 09:10:08.875702821,2023,12,2023-12-01,9,10,1,2,1,1.0,231,97.22991689750693,0.0,0.0,2.050876617,63.42124939,165.9860611,1.800806671,4.480345071,,100,44,1.7035412452999998,4.37325211433,,,,,,,,,,,3239
20,1701439812.0,2023-12-01 09:10:11.640184,2023-12-01 14:10:11.640184+00:00,235,18.8273685,12.48182931,149.7819518,LEV,13,3087,"On the seventh day, the priest shall examine the itch; and behold, if the itch hasn't spread in the skin, and its appearance isn't deeper than the skin, then the priest shall pronounce him clean. He shall wash his clothes and be clean.",34.0,159.95997103,141.91251445260002,137.57484439717,132.948,2023,12,9,1,2023-12-01,10,2,1,1,2023-12-01 09:10:30.467552500,2023,12,2023-12-01,9,10,1,2,1,0.0,1880,77.36962543658919,5.106382979,5.106382979,8.289337158,64.03923035,160.1054668,2.233925589,4.474590719,,100,45,2.1366601633999998,4.3731795804799996,,,,,,,,,,,3240
